{
    "FIO": "Иванов Андрей Петрович",
    "age": "35",
    "education": "03",
    "work_group": "01",
    "professional_properties": "dust",
    "telephone_number": "89342134590",
    "fluorography": "Без особенностей",
    "hiv": false,
    "blood_type": "0(I)Rh-",
    "infertility": {
        "infertility_occurence": true,
        "infertility_type": "01",
        "infetrility_duration": 2,
        "infertility_treatment": ["02", "03"],
        "infertility_causes": ["02", "03"]
    },
    "smoking": false,
    "alcohol": false,
    "toxic": false,
    "drugs": false,
    "hereditary": ["01", "10"],
    "finished_diseases": "Анемия",
    "current_diseases": "Отсутствуют"
}